Question,Answer
What are the five phases of the Wyckoff method?,"The Wyckoff method utilizes five distinct phases, labeled A through E, to structure the analysis of accumulation and distribution ranges: Stopping the Previous Trend: This phase marks the end of the prior trend and the beginning of a trading range. It involves events like the Preliminary Support/Supply, Selling/Buying Climax, Automatic Rally/Reaction, and Secondary Test. Phase B: Building the Cause: This phase involves the accumulation (or distribution) of shares by large operators, establishing the foundation for the subsequent move. It's characterized by multiple Secondary Tests and potential shakeouts within the range. Phase C: Test: This phase involves a definitive test of the remaining supply (or demand) through a Spring/Shakeout (in accumulation) or a UTAD (in distribution). This confirms whether the market is ready for a sustained move. Phase D: Trend within Range: This phase marks the beginning of a directional move within the range, with a Sign of Strength/Weakness and a Last Point of Support/Supply. It shows a clear shift in the balance of power. Phase E: Trend out of Range: This phase represents the final breakout from the trading range, confirming the start of a new trend. It involves a series of SOSs and LPSs (in an uptrend) or SOWs and LPSYs (in a downtrend)."
Why is Phase analysis important in the Wyckoff method?,"Phase analysis provides a structured framework for understanding the evolution of accumulation and distribution ranges. It helps traders: Identify the Market Context: By recognizing the current phase, traders can anticipate the likely price action and potential trading opportunities. Anticipate Key Events: Understanding the typical sequence of events within each phase allows traders to prepare for potential shakeouts, breakouts, and confirmations. Determine the Strength of the Move: The duration and intensity of each phase can offer insights into the strength of the accumulation or distribution, influencing the magnitude of the subsequent move."
What happens in Phase A: Stopping the Previous Trend?,"The primary objective of Phase A is to halt the preceding trend and establish a trading range. It's marked by a shift in control, as the dominant force weakens, allowing the opposing force to emerge.  Preliminary Support/Supply: This is the first sign of the trend weakening, with the price finding temporary support or resistance. Selling/Buying Climax: This event represents the culmination of the previous trend, often with high volume and volatility. It signifies a potential exhaustion of the dominant force. Automatic Rally/Reaction: This counter-trend move occurs after the climax, showing the initial strength of the opposing force. Secondary Test: This event retests the area of the climax, confirming the shift in control and the establishment of a trading range. Identifying these events is crucial for understanding the transition from a trending market to a range-bound market."
What is the significance of the Reaction in Phase A?,"The Reaction (Automatic Rally/Reaction), is particularly significant in Phase A as it confirms a potential shift in market sentiment. After a prolonged trend, the reaction marks the first notable counter-trend move, suggesting a growing interest from the opposing force. This event is often accompanied by a Change of Character (ChoCh), signaling the transition from a trend to a range."
What is the purpose of Phase B: Building the Cause?,"Phase B is crucial for establishing the foundation for the subsequent trend move. It's during this phase that large operators accumulate (or distribute) shares, creating the ""cause"" that will lead to the ""effect"" of the next trend. This process involves: Absorption/Distribution of Shares: Large operators systematically buy (or sell) shares, taking advantage of the range-bound price action to acquire inventory at favorable prices. Testing for Supply/Demand: Multiple Secondary Tests at both the upper and lower boundaries of the range help gauge the remaining supply or demand and confirm the control exerted by the dominant force. Shaking Out Weak Holders: Shakeouts within the range, like Springs or UTADs, further remove weak holders and allow large operators to accumulate more shares at lower prices (in accumulation) or distribute more at higher prices (in distribution). The duration and intensity of Phase B often provide clues about the potential strength of the upcoming trend."
What is the ideal duration of Phase B?,"Generally, in a well-formed Wyckoff structure, Phase B should be longer than both Phase A and Phase C. This suggests a deliberate and thorough accumulation or distribution process, allowing large operators to build a substantial position without significantly affecting the price. However, a shorter Phase B can also indicate urgency on the part of the dominant force, potentially leading to a more powerful trend move."
What happens in Phase C: Test?,"Phase C involves a decisive test of the remaining supply (in accumulation) or demand (in distribution). It aims to confirm whether the market is truly ready for a sustained move. Key Events in Phase C: Spring/Shakeout (Accumulation): This is a bearish move that breaks below support, trapping late sellers and allowing large operators to buy more shares at lower prices. UTAD (Distribution): This is a bullish move that breaks above resistance, trapping late buyers and allowing large operators to distribute more shares at higher prices. The success of these shakeouts is crucial for confirming the control exerted by the dominant force and signaling the potential start of a new trend."
What is a minor Spring/Upthrust in Phase C?,"While the classic Spring/UTAD involves breaking beyond the established trading range, a minor Spring/Upthrust occurs within the range, without violating the upper or lower boundaries. It still acts as a shakeout, testing for remaining supply or demand at those local highs or lows. Identifying these events within the context of the overall structure is crucial for understanding the ongoing accumulation or distribution process."
What is the purpose of Phase D: Trend Within Range?,"Phase D signifies a clear shift in the balance of power, as the price begins to move directionally within the trading range. This movement indicates that the dominant force is now in control and preparing for a breakout. Key Events in Phase D: Sign of Strength/Weakness: A decisive move towards the upper (SOS) or lower (SOW) boundary of the range, often with increasing volume and widening price spreads. Last Point of Support/Supply: The final pullback before the breakout, confirming the strength of the emerging trend. Identifying these events helps traders prepare for the potential breakout and confirm the direction of the upcoming trend."
What are the potential scenarios at the Creek/Ice level in Phase D?,"As the price approaches the Creek (in accumulation) or Ice (in distribution) levels, representing the last significant resistance/support within the range, three potential scenarios can unfold: Pullback and Retest: The price might pull back, forming an LPS/LPSY within the range, before making another attempt to break through the Creek/Ice, suggesting a need for more consolidation. Aggressive Breakout: Large operators might aggressively push the price through the Creek/Ice, absorbing or distributing remaining shares at a less favorable price, indicating strong conviction. Failed Breakout and Shakeout: The breakout attempt might fail, leading to a new shakeout (Spring/UTAD) in the opposite direction, potentially invalidating the previous analysis."
How do you identify a valid Spring pattern in Wyckoff methodology?,"A valid Spring pattern shows three key characteristics: 1) A price move below the trading range support level, 2) A quick price reversal back into the trading range, and 3) The move should occur on relatively lower volume than the previous selling climax. This represents absorption of supply and indicates potential accumulation completion."
What are the three types of Springs in Wyckoff methodology?,"Spring #1 (Terminal Shakeout): Shows high volume and deep penetration below support. Spring #2: Shows moderate penetration and volume. Spring #3: Shows minimal penetration and low volume, indicating supply exhaustion. Each type requires different trading approaches."
How do you determine the success of a Secondary Test in accumulation?,"A successful Secondary Test should show: 1) Lower volume than the Selling Climax, 2) Narrower price spread than the Selling Climax, 3) Price should hold at or above the Selling Climax low. This indicates diminishing supply."
What is the proper sequence of events in Wyckoff Phase A accumulation?,"The proper sequence is: 1) Preliminary Support (PS), 2) Selling Climax (SC), 3) Automatic Rally (AR), 4) Secondary Test (ST). This sequence marks the stopping of the previous downtrend and beginning of accumulation."
How do you identify a Sign of Strength (SOS) in Wyckoff methodology?,"A Sign of Strength shows: 1) Price advance with wider spread than previous bars, 2) Higher than average volume, 3) Closes near the high of the move, 4) Often occurs after a spring or successful test. This indicates institutional buying."
What are the key differences between accumulation and reaccumulation?,"Reaccumulation occurs during an existing uptrend while accumulation occurs after a downtrend. Reaccumulation typically shows shorter duration, smaller amplitude, and lacks the dramatic PS, SC, AR sequence seen in accumulation."
How do you apply the Wyckoff law of Effort vs Result in trading?,"Compare volume (effort) with price movement (result). When high volume produces little price movement at resistance, it suggests supply absorption. When high volume at support produces minimal downward price movement, it suggests demand absorption."
What are the key characteristics of a valid Last Point of Support (LPS)?,"A valid LPS shows: 1) A pullback to former resistance turned support, 2) Decreased volume compared to previous reactions, 3) Narrower price spread, 4) Often occurs after a Sign of Strength, providing an entry opportunity."
How do you identify a Change of Character (CHoCh) in price movement?,"A Change of Character is identified by: 1) A significant change in price behavior, 2) Usually accompanied by increased volume, 3) Movement contrary to the previous trend, 4) Often seen after climactic action or during phase transitions."
What are the essential characteristics of Phase C in accumulation?,"Phase C shows: 1) A decisive test of remaining supply, 2) Often includes a spring or shakeout, 3) Should show decreased volume on the test, 4) Followed by a Sign of Strength if successful."
How do you identify the end of Phase B in accumulation?,"Phase B ends when: 1) Volume on downswings diminishes significantly, 2) Price ranges become tighter, 3) Tests of support show decreasing supply, 4) The stock appears ready for Phase C testing."
What distinguishes a valid Buying Climax (BC) from normal upside momentum?,"A valid Buying Climax shows: 1) Significantly increased volume, 2) Wide price spread, 3) Often coincides with good news or strong earnings, 4) Followed by an Automatic Reaction showing supply emergence."
How do you identify a valid Last Point of Supply (LPSY)?,"A valid LPSY shows: 1) Weak rally attempt after a Sign of Weakness, 2) Narrow price spread, 3) Low volume compared to previous rallies, 4) Often provides the final shorting opportunity before markdown."
What are the key characteristics of Phase D in distribution?,"Phase D shows: 1) Clear dominance of supply over demand, 2) Weak rallies (LPSYs), 3) Price moves below trading range support or midpoint, 4) Multiple opportunities to initiate short positions."
How do you use Wyckoff's nine buying tests in accumulation?,"Apply the tests sequentially: 1) Check for downside objective completion, 2) Confirm PS-SC-AR-ST sequence, 3) Analyze volume behavior, 4) Check trend line breaks, 5) Verify higher highs and lows, 6) Compare relative strength, 7) Confirm base formation."
What distinguishes an Upthrust After Distribution (UTAD) from a normal Upthrust?,"A UTAD occurs specifically in Phase C of distribution and shows: 1) Quick penetration above resistance, 2) Immediate reversal, 3) Usually higher volume than normal upthrusts, 4) Often represents the final bull trap before markdown."
How do you identify the completion of Phase E in accumulation?,"Phase E completion shows: 1) Clear breakout from trading range, 2) Increased volume on advances, 3) Successful tests of former resistance, 4) Higher highs and higher lows established in clear uptrend."
What are the key elements to analyze in a Spring test?,"Analyze: 1) Volume comparison with the Spring, 2) Price spread reduction, 3) Location relative to Spring low, 4) Quality of rally after test. Lower volume and tighter spread indicate successful test."
How do you identify terminal weakness in Phase B of distribution?,"Look for: 1) Decreasing volume on rallies, 2) Increasing volume on reactions, 3) Lower highs forming, 4) Poor response to support tests, indicating supply dominance."
What defines a successful Back Up to the Edge of the Creek (BUEC)?,"A successful BUEC shows: 1) Pullback to broken resistance level, 2) Decreased volume, 3) Narrowing price spread, 4) Strong support at former resistance level."
How do you identify a valid Sign of Weakness (SOW)?,"A valid SOW shows: 1) Price decline on expanding spread, 2) Higher than average volume, 3) Closes near the low of the move, 4) Often breaks below trading range support."
What are the key differences between Phase B in accumulation versus distribution?,"In accumulation, Phase B shows decreasing volume on reactions and absorption of supply. In distribution, Phase B shows decreasing volume on rallies and absorption of demand. Both build cause but in opposite directions."
How do you apply Wyckoff's law of Cause and Effect in price projections?,Measure the cause (horizontal price movement in trading range) to project the effect (potential price movement). Longer trading ranges typically lead to larger subsequent moves.
What defines a successful Secondary Test as Sign of Weakness (ST as SOW)?,"A successful ST as SOW shows: 1) Break below previous support, 2) Lower volume than previous decline, 3) Quick return into trading range, 4) Often precedes further weakness."
How do you identify absorption of supply in accumulation?,"Look for: 1) High volume reactions with minimal price decline, 2) Decreasing volume on subsequent tests, 3) Narrowing price spreads on reactions, 4) Higher lows forming."
What are the key elements of a valid Automatic Rally (AR)?,"A valid AR shows: 1) Sharp price recovery after Selling Climax, 2) Good volume but less than SC, 3) Establishes trading range resistance, 4) First significant rally after downtrend."
How do you identify the difference between re-accumulation and distribution?,"Analyze: 1) Prior trend context, 2) Volume characteristics on rallies and reactions, 3) Quality of tests at support and resistance, 4) Relative strength compared to market."
What defines a successful Selling Climax (SC)?,"A successful SC shows: 1) Climactic volume increase, 2) Wide price spread, 3) Close off the lows, 4) Marks potential end of downtrend."
How do you identify valid creek resistance in accumulation?,"Creek resistance is identified by: 1) Level established by Automatic Rally, 2) Multiple tests at similar price level, 3) Volume behavior at tests, 4) Quality of reactions from level."
What are the key characteristics of Phase E in distribution?,"Phase E shows: 1) Clear break below trading range support, 2) Increased volume on declines, 3) Failed tests of former support, 4) Lower highs and lower lows establishing downtrend."
How do you identify a valid spring in re-accumulation?,"In re-accumulation, a valid spring shows: 1) Shallower penetration than primary accumulation, 2) Lower volume than main spring, 3) Quick recovery, 4) Often occurs at previous support level."
What defines successful absorption of demand in distribution?,"Look for: 1) High volume rallies with minimal price advance, 2) Decreasing volume on subsequent rallies, 3) Narrowing price spreads on advances, 4) Lower highs forming."
How do you identify a valid preliminary support (PS)?,"Valid PS shows: 1) First significant support after downtrend, 2) Increased volume, 3) Often fails leading to SC, 4) Marks beginning of potential accumulation."
What are the key differences between Phase C in accumulation versus distribution?,"Accumulation Phase C tests supply through springs, while distribution Phase C tests demand through upthrusts. Both serve to verify market readiness for trend change."
How do you identify valid ice support in distribution?,"Ice support is identified by: 1) Level established by Automatic Reaction, 2) Multiple tests at similar price level, 3) Volume behavior at tests, 4) Quality of rallies from level."
What defines a successful test after Sign of Strength (SOS)?,"A successful test shows: 1) Pullback on decreasing volume, 2) Narrower price spread than SOS, 3) Support at higher level than previous tests, 4) Strong rally following test."
How do you identify distribution after prolonged uptrend?,"Look for: 1) Climactic buying on high volume, 2) Automatic reaction showing supply, 3) Weaker rallies on tests, 4) Decreasing volume on advances."
What are the key characteristics of a valid Automatic Reaction (AR) in distribution?,"Valid AR shows: 1) Sharp decline after Buying Climax, 2) Good volume but less than BC, 3) Establishes trading range support, 4) First significant decline after uptrend."
How do you identify valid accumulation after prolonged downtrend?,"Look for: 1) Climactic selling on high volume, 2) Automatic rally showing demand, 3) Stronger tests of support, 4) Decreasing volume on declines."
What defines successful phase transitions in Wyckoff methodology?,"Successful transitions show: 1) Completion of phase objectives, 2) Clear change in price/volume behavior, 3) Confirmation through tests, 4) Preparation for next phase."
How do you identify a valid preliminary supply (PSY)?,"Valid PSY shows: 1) First significant resistance after uptrend, 2) Increased volume, 3) Often fails leading to BC, 4) Marks beginning of potential distribution."
What are the key elements of a successful markup campaign?,"Successful markup shows: 1) Higher highs and higher lows, 2) Increased volume on advances, 3) Successful tests of support, 4) Strong relative strength."
How do you identify valid Phase B support tests?,"Valid support tests show: 1) Decreasing volume on reactions, 2) Narrowing price spreads, 3) Higher lows forming, 4) Strong rallies following tests."
What defines successful resistance tests in distribution?,"Successful resistance tests show: 1) Weaker rallies each test, 2) Lower volume than previous tests, 3) Signs of supply entering market, 4) Quick reversals from resistance."
How do you identify valid shakeouts in trends?,"Valid shakeouts show: 1) Quick penetration of support, 2) Rapid recovery, 3) Often occurs on high volume, 4) Followed by trend continuation."
What are the key characteristics of successful LPS tests?,"Successful LPS tests show: 1) Support at higher levels, 2) Decreasing volume, 3) Narrow price spread, 4) Strong rally following test."
How do you identify valid LPSY tests?,"Valid LPSY tests show: 1) Resistance at lower levels, 2) Weak volume on rallies, 3) Narrow price spread, 4) Strong decline following test."
What defines successful trend tests in Phase E?,"Successful trend tests show: 1) Support/resistance at previous turning points, 2) Appropriate volume characteristics, 3) Maintenance of trend structure, 4) Strong continuation after test."
How do you identify valid re-distribution patterns?,"Valid re-distribution shows: 1) Similar structure to distribution but smaller scale, 2) Occurs during downtrend, 3) Shows supply dominance, 4) Leads to further decline."
What are the key elements of successful cause building?,"Successful cause building shows: 1) Clear trading range development, 2) Appropriate volume characteristics, 3) Tests of support/resistance, 4) Evidence of accumulation/distribution."
How do you identify valid markup tests?,"Valid markup tests show: 1) Support at previous resistance levels, 2) Decreased volume on pullbacks, 3) Maintenance of trend structure, 4) Strong continuation after test."
What defines successful markdown tests?,"Successful markdown tests show: 1) Resistance at previous support levels, 2) Weak volume on rallies, 3) Maintenance of downtrend structure, 4) Strong continuation lower after test."
How do you identify valid spring failures?,"Spring failures show: 1) Inability to return to trading range, 2) Increasing volume on decline, 3) Lack of demand response, 4) Continuation of downtrend."
What are the key characteristics of successful UTAD tests?,"Successful UTAD tests show: 1) Lower volume than UTAD, 2) Inability to reach UTAD high, 3) Signs of supply, 4) Strong decline following test."
How do you identify valid trend emergence?,"Valid trend emergence shows: 1) Clear break from trading range, 2) Appropriate volume confirmation, 3) Successful tests of breakout level, 4) Continuation of price movement."
What defines successful minor trend tests?,"Successful minor trend tests show: 1) Support/resistance at appropriate levels, 2) Volume confirmation, 3) Quick resolution, 4) Continuation of larger trend."
How do you identify valid accumulation Tests?,"Valid accumulation tests show: 1) Support holding above previous lows, 2) Decreasing volume on declines, 3) Signs of demand, 4) Strong rally following test."
What are the key elements of successful distribution tests?,"Successful distribution tests show: 1) Resistance holding below previous highs, 2) Decreasing volume on rallies, 3) Signs of supply, 4) Strong decline following test."
How do you identify valid trend termination?,"Valid trend termination shows: 1) Climactic action, 2) Change in price/volume behavior, 3) Failed trend continuation attempts, 4) Beginning of trading range development."
What defines successful relative strength analysis?,"Successful relative strength analysis shows: 1) Comparison with market indexes, 2) Higher highs/lows than market in uptrends, 3) Lower highs/lows than market in downtrends, 4) Clear strength/weakness patterns."
How do you identify valid Phase D continuation?,"Valid Phase D continuation shows: 1) Clear trend development within the trading range, 2) Increasing volume on moves in trend direction, 3) Successful tests of support/resistance, 4) Movement toward range boundaries."
What are the key elements of Wyckoff's comparative strength method?,"The comparative strength method involves: 1) Comparing stock performance to market indexes, 2) Analyzing relative wave structures, 3) Evaluating momentum differences, 4) Identifying leadership characteristics."
How do you apply Wyckoff's effort-versus-result principle in accumulation?,"Look for: 1) High volume reactions with minimal price decline, 2) Strong price advances on lower volume, 3) Failed selling attempts, 4) Evidence of supply absorption through volume analysis."
What defines a valid terminal shakeout?,"A terminal shakeout shows: 1) Deeper penetration than normal springs, 2) Extremely high volume, 3) Rapid price recovery, 4) Often marks end of accumulation."
How do you identify valid stepping stone confirmations?,"Valid stepping stones show: 1) Smaller reaccumulation patterns, 2) Successful tests of support, 3) Continuation of primary trend, 4) Appropriate volume characteristics."
What are the key characteristics of successful point and figure counts?,"Successful P&F counts show: 1) Clear cause built in trading range, 2) Horizontal count measurement, 3) Realistic price targets, 4) Confirmation through market action."
How do you identify valid creek jump (JAC)?,"Valid creek jump shows: 1) Strong price advance through resistance, 2) Increased volume, 3) Minimal pullback, 4) Continuation of upward movement."
What defines successful supply tests?,"Successful supply tests show: 1) Decreasing volume on declines, 2) Narrowing price spreads, 3) Higher levels of support, 4) Strong demand response."
How do you identify valid demand tests?,"Valid demand tests show: 1) Strong buying response, 2) Appropriate volume increase, 3) Quick price recovery, 4) Higher levels established."
What are the key elements of successful back-up action?,"Successful back-up shows: 1) Orderly pullback to support, 2) Decreasing volume, 3) Maintained trend structure, 4) Strong continuation after test."
How do you identify valid Phase E emergence?,"Valid Phase E shows: 1) Clear break from trading range, 2) Strong volume confirmation, 3) Successful tests of breakout, 4) Establishment of trend."
What defines successful absorption indicators?,"Successful absorption shows: 1) High volume with minimal price movement, 2) Decreasing supply/demand pressure, 3) Change in price behavior, 4) Preparation for trend change."
How do you identify valid throwback opportunities?,"Valid throwbacks show: 1) Pullback to broken resistance/support, 2) Decreased volume, 3) Maintained trend structure, 4) Strong continuation."
What are the key characteristics of successful volume analysis?,"Successful volume analysis shows: 1) Correlation with price movement, 2) Confirmation of trends, 3) Evidence of absorption, 4) Warning signs of reversal."
How do you identify valid breakout failures?,"Valid breakout failures show: 1) Lack of follow-through, 2) Poor volume confirmation, 3) Quick return to trading range, 4) Often leads to opposite movement."
What defines successful trend confirmation?,"Successful trend confirmation shows: 1) Strong price movement, 2) Appropriate volume, 3) Successful tests, 4) Continuation patterns."
