Question,Answer
How do you identify valid cause completion?,"Valid cause completion shows: 1) Sufficient trading range development, 2) Clear supply/demand resolution, 3) Preparation for trend, 4) Break from range."
What are the key elements of successful markup identification?,"Successful markup shows: 1) Higher highs and lows, 2) Strong volume on advances, 3) Successful tests, 4) Clear trend structure."
How do you identify valid markdown characteristics?,"Valid markdown shows: 1) Lower highs and lows, 2) Strong volume on declines, 3) Failed rallies, 4) Clear downtrend structure."
What defines successful resistance breakthrough?,"Successful resistance breakthrough shows: 1) Strong price movement, 2) Increased volume, 3) Minimal pullback, 4) Continuation pattern."
How do you identify valid support breaks?,"Valid support breaks show: 1) Decisive price movement, 2) Increased volume, 3) Failed recovery attempts, 4) Continuation lower."
What are the key characteristics of successful range analysis?,"Successful range analysis shows: 1) Clear boundaries, 2) Identifiable phases, 3) Appropriate volume patterns, 4) Clear accumulation/distribution evidence."
How do you identify valid trend resumption?,"Valid trend resumption shows: 1) Successful test of support/resistance, 2) Appropriate volume, 3) Continuation pattern, 4) Strong movement in trend direction."
What defines successful phase transitions?,"Successful phase transitions show: 1) Completion of current phase objectives, 2) Clear change in behavior, 3) Preparation for next phase, 4) Appropriate volume characteristics."
How do you identify valid climax action?,"Valid climax action shows: 1) Extreme price movement, 2) Very high volume, 3) Reversal potential, 4) Often marks trend termination."
What are the key elements of successful spring analysis?,"Successful spring analysis shows: 1) Clear support violation, 2) Quick recovery, 3) Volume confirmation, 4) Follow-through movement."
How do you identify valid upthrust characteristics?,"Valid upthrust shows: 1) False breakout above resistance, 2) Quick reversal, 3) Often high volume, 4) Failed continuation."
What defines successful testing action?,"Successful testing shows: 1) Return to support/resistance, 2) Appropriate volume reduction, 3) Clear price response, 4) Strong continuation."
How do you identify valid cause measurement?,"Valid cause measurement shows: 1) Clear trading range boundaries, 2) Sufficient time development, 3) Appropriate phase analysis, 4) Realistic projections."
What are the key characteristics of successful markup campaigns?,"Successful markup campaigns show: 1) Clear accumulation completion, 2) Strong breakout, 3) Successful tests, 4) Trend continuation."
How do you identify valid markdown campaigns?,"Valid markdown campaigns show: 1) Clear distribution completion, 2) Strong breakdown, 3) Failed rallies, 4) Trend continuation."
What defines successful relative strength comparison?,"Successful relative strength comparison shows: 1) Clear outperformance/underperformance, 2) Trend alignment, 3) Volume confirmation, 4) Consistent behavior."
How do you identify valid volume spreads?,"Valid volume spreads show: 1) Correlation with price movement, 2) Confirmation of trend, 3) Warning signs, 4) Absorption evidence."
What are the key elements of successful phase recognition?,"Successful phase recognition shows: 1) Clear phase characteristics, 2) Appropriate sequence, 3) Volume confirmation, 4) Logical progression."
How do you identify valid trend tests?,"Valid trend tests show: 1) Return to support/resistance, 2) Appropriate volume, 3) Quick resolution, 4) Strong continuation."
What defines successful range completion?,"Successful range completion shows: 1) Clear phase development, 2) Supply/demand resolution, 3) Break preparation, 4) Strong movement."
How do you identify valid watershed moments?,"Valid watershed moments show: 1) Clear change in behavior, 2) Volume confirmation, 3) Trend change potential, 4) Strong follow-through."
What are the key characteristics of successful continuation patterns?,"Successful continuation patterns show: 1) Clear trend pause, 2) Appropriate volume, 3) Maintenance of trend structure, 4) Strong continuation."
How do you identify valid reversal patterns?,"Valid reversal patterns show: 1) Clear trend exhaustion, 2) Change in behavior, 3) Volume confirmation, 4) Strong counter-trend movement."
What defines successful technical position?,"Successful technical position shows: 1) Clear trend definition, 2) Support/resistance identification, 3) Volume confirmation, 4) Risk management opportunity."
